<!ELEMENT biblioteca (libro+)>
<!ELEMENT libro (titulo,autor,editorial,año)>
<!ELEMENT titulo (#PCDATA)>
<!ELEMENT autor (#PCDATA)>
<!ELEMENT editorial (#PCDATA)>
<!ELEMENT año (#PCDATA)>
<!ATTLIST libro idioma CDATA #IMPLIED>