<?xml version="1.0"?>
<!DOCTYPE biblioteca SYSTEM "ejercicio_1.dtd">
<biblioteca>
  <libro idioma="es">
    <titulo>El Quijote</titulo>
    <autor>Cervantes</autor>
    <editorial>Alfaguara</editorial>
    <a単o>1605</a単o>
  </libro>
  <libro idioma="es">
    <titulo>El Quijote</titulo>
    <autor>Cervantes</autor>
    <editorial>Alfaguara</editorial>
    <a単o>1605</a単o>
  </libro>
</biblioteca>
